{"authority":"Frozen Mac Qdrant payload, including drifted/missing-source text; current source files are locator witnesses only.","child_count":904,"collection":"developer_knowledge_v10","edition":{"reason":"not found","value":null},"files":[{"backend":"main-checkout","bytes":664529,"path":"data/markdown/joy-of-cryptography.md","sha256":"f20fdbeb169daf21144feebf6c89f83c14949338a9ded88156900219a5f35b20"},{"backend":"main-checkout","bytes":1985468,"path":"data/chunks/joy-of-cryptography.json","sha256":"2264b0b7c0767674dc64329bca464c19a4eb2a4c3d6c77b94ee264a867d5e520"}],"frozen_payload_inventory_sha256":"20f0ec6b5e2309f96bb4cec3ceaf91e27d1f8e3fa6207d830a947ce25588a078","original_acquired_at":{"reason":"not found","value":null},"original_asset":{"reason":"not found","value":null},"page_mapping":{"reason":"not found","value":null},"parent_count":159,"publication_date":{"reason":"not found","value":null},"reasons":{"dates":"No verified publication, revision or original acquisition date was found.","edition":"No verified edition-to-frozen-payload binding was found.","original_asset":"Requested main Library contains no book assets. Normalized files are separate observed witnesses.","page_mapping":"No verified physical page or EPUB-resource offset mapping exists for this frozen generation."},"revision_date":{"reason":"not found","value":null},"schema_version":"mind/frozen-source-manifest@1","source_id":"book:joy-of-cryptography","source_key":"joy-of-cryptography"}
