{"authority":"Frozen Mac Qdrant payload, including drifted/missing-source text; current source files are locator witnesses only.","child_count":1585,"collection":"developer_knowledge_v10","edition":{"reason":"not found","value":null},"files":[{"backend":"main-checkout","bytes":1282853,"path":"data/markdown/understanding-deep-learning.md","sha256":"82c2839c058dc77d8d4968cab770caead02c11b51399007858de1ec7ca136d58"},{"backend":"main-checkout","bytes":3669321,"path":"data/chunks/understanding-deep-learning.json","sha256":"6ec8b70191786d4822d028ba94fd527fc71670f649e8b7e3284e94e2a5055728"}],"frozen_payload_inventory_sha256":"1990def96a31941c023c5aa0ed56a655a1a98dc4cb10c6ac9bd64487d48b9229","original_acquired_at":{"reason":"not found","value":null},"original_asset":{"reason":"not found","value":null},"page_mapping":{"reason":"not found","value":null},"parent_count":276,"publication_date":{"reason":"not found","value":null},"reasons":{"dates":"No verified publication, revision or original acquisition date was found.","edition":"No verified edition-to-frozen-payload binding was found.","original_asset":"Requested main Library contains no book assets. Normalized files are separate observed witnesses.","page_mapping":"No verified physical page or EPUB-resource offset mapping exists for this frozen generation."},"revision_date":{"reason":"not found","value":null},"schema_version":"mind/frozen-source-manifest@1","source_id":"book:understanding-deep-learning","source_key":"understanding-deep-learning"}
