{"authority":"Frozen Mac Qdrant payload, including drifted/missing-source text; current source files are locator witnesses only.","child_count":578,"collection":"developer_knowledge_v10","edition":{"reason":"not found","value":null},"files":[{"backend":"main-checkout","bytes":589523,"path":"data/markdown/project-management-with-ai.md","sha256":"aad3fb9ed790d3e20cb732d41b5481ced0176498a66da8c1c60664e92ef7194a"},{"backend":"main-checkout","bytes":1878676,"path":"data/chunks/project-management-with-ai.json","sha256":"30094b4d17cc783eb777c3e9185640050f47028b840e23c53520b2c5d0657175"}],"frozen_payload_inventory_sha256":"70b134bca42dc73a859b839b2878742d2bb71885cdb49989b52de0b1a7a9b279","original_acquired_at":{"reason":"not found","value":null},"original_asset":{"reason":"not found","value":null},"page_mapping":{"reason":"not found","value":null},"parent_count":286,"publication_date":{"reason":"not found","value":null},"reasons":{"dates":"No verified publication, revision or original acquisition date was found.","edition":"No verified edition-to-frozen-payload binding was found.","original_asset":"Requested main Library contains no book assets. Normalized files are separate observed witnesses.","page_mapping":"No verified physical page or EPUB-resource offset mapping exists for this frozen generation."},"revision_date":{"reason":"not found","value":null},"schema_version":"mind/frozen-source-manifest@1","source_id":"book:project-management-with-ai","source_key":"project-management-with-ai"}
