{"authority":"Frozen Mac Qdrant payload, including drifted/missing-source text; current source files are locator witnesses only.","child_count":771,"collection":"developer_knowledge_v10","edition":{"reason":"not found","value":null},"files":[{"backend":"main-checkout","bytes":567302,"path":"data/markdown/pandascookbook_thirdedition.md","sha256":"40d9373632ae3e774e0ec546387de96b8dfa34e1ea9285b5a59d590696a6e7dd"},{"backend":"main-checkout","bytes":1697354,"path":"data/chunks/pandascookbook_thirdedition.json","sha256":"46e9301406ec470e6073a7af3e26a50c86334160f8ec4d4bc8bcc173d6e202f0"}],"frozen_payload_inventory_sha256":"afc36ebadaabf9ad03d59b8f15903768db58f38b9ce4282b35448fe282e3ba5b","original_acquired_at":{"reason":"not found","value":null},"original_asset":{"reason":"not found","value":null},"page_mapping":{"reason":"not found","value":null},"parent_count":192,"publication_date":{"reason":"not found","value":null},"reasons":{"dates":"No verified publication, revision or original acquisition date was found.","edition":"No verified edition-to-frozen-payload binding was found.","original_asset":"Requested main Library contains no book assets. Normalized files are separate observed witnesses.","page_mapping":"No verified physical page or EPUB-resource offset mapping exists for this frozen generation."},"revision_date":{"reason":"not found","value":null},"schema_version":"mind/frozen-source-manifest@1","source_id":"book:pandascookbook_thirdedition","source_key":"pandascookbook_thirdedition"}
