{"authority":"Frozen Mac Qdrant payload, including drifted/missing-source text; current source files are locator witnesses only.","child_count":313,"collection":"developer_knowledge_v10","edition":{"reason":"not found","value":null},"files":[{"backend":"main-checkout","bytes":260252,"path":"data/markdown/designing-distributed-systems.md","sha256":"e65a001b6a7878cd7650b5ebd98a6c584d6608cda091052bdd2c3c4ade9f1c66"},{"backend":"main-checkout","bytes":824435,"path":"data/chunks/designing-distributed-systems.json","sha256":"58d316cbedf8151be383ba785c367b6bbbd6d13099122461475c79226cad2d35"}],"frozen_payload_inventory_sha256":"255e83054f41a76b76b4409247dc14fc42dc7b9af7ab6ef1c9b6ad8697023ad4","original_acquired_at":{"reason":"not found","value":null},"original_asset":{"reason":"not found","value":null},"page_mapping":{"reason":"not found","value":null},"parent_count":114,"publication_date":{"reason":"not found","value":null},"reasons":{"dates":"No verified publication, revision or original acquisition date was found.","edition":"No verified edition-to-frozen-payload binding was found.","original_asset":"Requested main Library contains no book assets. Normalized files are separate observed witnesses.","page_mapping":"No verified physical page or EPUB-resource offset mapping exists for this frozen generation."},"revision_date":{"reason":"not found","value":null},"schema_version":"mind/frozen-source-manifest@1","source_id":"book:designing-distributed-systems","source_key":"designing-distributed-systems"}
