{"authority":"Frozen Mac Qdrant payload, including drifted/missing-source text; current source files are locator witnesses only.","child_count":265,"collection":"developer_knowledge_v10","edition":{"reason":"not found","value":null},"files":[{"backend":"main-checkout","bytes":253104,"path":"data/markdown/owasp-asvs-v5.md","sha256":"1a3c7ce42b493737396aa20834beba7deb278b911e5deb6363f1a30473365485"},{"backend":"main-checkout","bytes":686464,"path":"data/chunks/owasp-asvs-v5.json","sha256":"3af16cac1792e7a217da627df11b0e5b18a2aedd939b75201de6a4e34dce5abe"}],"frozen_payload_inventory_sha256":"ab4d6534a6439b22d92ef8f055a26499c8b7808c12547ab48a946120058cf0ac","original_acquired_at":{"reason":"not found","value":null},"original_asset":{"reason":"not found","value":null},"page_mapping":{"reason":"not found","value":null},"parent_count":58,"publication_date":{"reason":"not found","value":null},"reasons":{"dates":"No verified publication, revision or original acquisition date was found.","edition":"No verified edition-to-frozen-payload binding was found.","original_asset":"Requested main Library contains no book assets. Normalized files are separate observed witnesses.","page_mapping":"No verified physical page or EPUB-resource offset mapping exists for this frozen generation."},"revision_date":{"reason":"not found","value":null},"schema_version":"mind/frozen-source-manifest@1","source_id":"book:owasp-asvs-v5","source_key":"owasp-asvs-v5"}
