{"authority":"Frozen Mac Qdrant payload, including drifted/missing-source text; current source files are locator witnesses only.","child_count":172,"collection":"developer_knowledge_v10","edition":{"reason":"not found","value":null},"files":[{"backend":"main-checkout","bytes":175274,"path":"data/markdown/laws-of-ux.md","sha256":"4757f07ad76d86f60ed9fabe30a560b80eb007736781a3f9dfbb22df1a6acb05"},{"backend":"main-checkout","bytes":471617,"path":"data/chunks/laws-of-ux.json","sha256":"4d04a6065f4610f9a2ab59f26b13ea9717b9d5c7b69ef4311ae83f90baa46dc3"}],"frozen_payload_inventory_sha256":"2f824c2e6a3f3f5c93322f9a47f79e59c52801c1f4a7efc8360c6bdf382624b9","original_acquired_at":{"reason":"not found","value":null},"original_asset":{"reason":"not found","value":null},"page_mapping":{"reason":"not found","value":null},"parent_count":49,"publication_date":{"reason":"not found","value":null},"reasons":{"dates":"No verified publication, revision or original acquisition date was found.","edition":"No verified edition-to-frozen-payload binding was found.","original_asset":"Requested main Library contains no book assets. Normalized files are separate observed witnesses.","page_mapping":"No verified physical page or EPUB-resource offset mapping exists for this frozen generation."},"revision_date":{"reason":"not found","value":null},"schema_version":"mind/frozen-source-manifest@1","source_id":"book:laws-of-ux","source_key":"laws-of-ux"}
