{"authority":"Frozen Mac Qdrant payload, including drifted/missing-source text; current source files are locator witnesses only.","child_count":758,"collection":"developer_knowledge_v10","edition":{"reason":"not found","value":null},"files":[{"backend":"main-checkout","bytes":622857,"path":"data/markdown/data-science-from-scratch.md","sha256":"164f476ec2e4502d550f23e87aab3e3831a46a76059850940a8e4a524d3d48c8"},{"backend":"main-checkout","bytes":1853412,"path":"data/chunks/data-science-from-scratch.json","sha256":"e0d9dfe7191f8ddf9919edbf5987f5cfdbdc38c126ab885e77c30bf5c965f49e"}],"frozen_payload_inventory_sha256":"9350e33f67399bd907eef0fa98a52b37c23441fadfb058152943417376807944","original_acquired_at":{"reason":"not found","value":null},"original_asset":{"reason":"not found","value":null},"page_mapping":{"reason":"not found","value":null},"parent_count":180,"publication_date":{"reason":"not found","value":null},"reasons":{"dates":"No verified publication, revision or original acquisition date was found.","edition":"No verified edition-to-frozen-payload binding was found.","original_asset":"Requested main Library contains no book assets. Normalized files are separate observed witnesses.","page_mapping":"No verified physical page or EPUB-resource offset mapping exists for this frozen generation."},"revision_date":{"reason":"not found","value":null},"schema_version":"mind/frozen-source-manifest@1","source_id":"book:data-science-from-scratch","source_key":"data-science-from-scratch"}
