{"authority":"Frozen Mac Qdrant payload, including drifted/missing-source text; current source files are locator witnesses only.","child_count":582,"collection":"developer_knowledge_v10","edition":{"reason":"not found","value":null},"files":[{"backend":"main-checkout","bytes":626661,"path":"data/markdown/data-governance-unity-catalog.md","sha256":"056028e89dadfaa472ffde3fb7a4bf30f56d57324d91f5effa6244189dd0adfc"},{"backend":"main-checkout","bytes":1772438,"path":"data/chunks/data-governance-unity-catalog.json","sha256":"8fa96a3c7279cf6d9c39eccc4c5e718ef2ed6c7acab5ad1dde9e0fadec984398"}],"frozen_payload_inventory_sha256":"7a2a0d8975177b31de6887139d6c721b3ee58b5c883bc5a2fc169000d38c4733","original_acquired_at":{"reason":"not found","value":null},"original_asset":{"reason":"not found","value":null},"page_mapping":{"reason":"not found","value":null},"parent_count":166,"publication_date":{"reason":"not found","value":null},"reasons":{"dates":"No verified publication, revision or original acquisition date was found.","edition":"No verified edition-to-frozen-payload binding was found.","original_asset":"Requested main Library contains no book assets. Normalized files are separate observed witnesses.","page_mapping":"No verified physical page or EPUB-resource offset mapping exists for this frozen generation."},"revision_date":{"reason":"not found","value":null},"schema_version":"mind/frozen-source-manifest@1","source_id":"book:data-governance-unity-catalog","source_key":"data-governance-unity-catalog"}
