{"authority":"Frozen Mac Qdrant payload, including drifted/missing-source text; current source files are locator witnesses only.","child_count":385,"collection":"developer_knowledge_v10","edition":{"reason":"not found","value":null},"files":[{"backend":"main-checkout","bytes":342510,"path":"data/markdown/owasp-developer-guide.md","sha256":"2d31b5dd8f03e32da79250be8dd5c6870cb5b45b2a3932e0f96d5d47cb7b22a0"},{"backend":"main-checkout","bytes":989521,"path":"data/chunks/owasp-developer-guide.json","sha256":"1707ab6ac822fe4ea52c1c6f61939942e22cda23c26e7c31f55d37116dde7b52"}],"frozen_payload_inventory_sha256":"63ea7a3b1181f3943243101996cf8b746f3ee9b3d5be6f58fef3972d9490e8e9","original_acquired_at":{"reason":"not found","value":null},"original_asset":{"reason":"not found","value":null},"page_mapping":{"reason":"not found","value":null},"parent_count":84,"publication_date":{"reason":"not found","value":null},"reasons":{"dates":"No verified publication, revision or original acquisition date was found.","edition":"No verified edition-to-frozen-payload binding was found.","original_asset":"Requested main Library contains no book assets. Normalized files are separate observed witnesses.","page_mapping":"No verified physical page or EPUB-resource offset mapping exists for this frozen generation."},"revision_date":{"reason":"not found","value":null},"schema_version":"mind/frozen-source-manifest@1","source_id":"book:owasp-developer-guide","source_key":"owasp-developer-guide"}
