{"authority":"Frozen Mac Qdrant payload, including drifted/missing-source text; current source files are locator witnesses only.","child_count":1184,"collection":"developer_knowledge_v10","edition":{"reason":"not found","value":null},"files":[{"backend":"main-checkout","bytes":981542,"path":"data/markdown/css-in-depth-2e.md","sha256":"8d4d9b93b7c1298aebaf48fcf82f0aab43942fd5b4784f6ebbfe743c45030699"},{"backend":"main-checkout","bytes":3001792,"path":"data/chunks/css-in-depth-2e.json","sha256":"d22c36650361709c70c0e309427289c07bb94e51fb5e8264deaa92917a3fd666"}],"frozen_payload_inventory_sha256":"acabf86af3cf5fac2d5b0986886896cbc47cbee628446febae8e8cd55c261bce","original_acquired_at":{"reason":"not found","value":null},"original_asset":{"reason":"not found","value":null},"page_mapping":{"reason":"not found","value":null},"parent_count":324,"publication_date":{"reason":"not found","value":null},"reasons":{"dates":"No verified publication, revision or original acquisition date was found.","edition":"No verified edition-to-frozen-payload binding was found.","original_asset":"Requested main Library contains no book assets. Normalized files are separate observed witnesses.","page_mapping":"No verified physical page or EPUB-resource offset mapping exists for this frozen generation."},"revision_date":{"reason":"not found","value":null},"schema_version":"mind/frozen-source-manifest@1","source_id":"book:css-in-depth-2e","source_key":"css-in-depth-2e"}
