{"authority":"Frozen Mac Qdrant payload, including drifted/missing-source text; current source files are locator witnesses only.","child_count":935,"collection":"developer_knowledge_v10","edition":{"reason":"not found","value":null},"files":[{"backend":"main-checkout","bytes":749547,"path":"data/markdown/cloud-native-security-cookbook.md","sha256":"a35f0103511429eee222215fb081e57f31212e5186989388f0c92485ba184f37"},{"backend":"main-checkout","bytes":2613926,"path":"data/chunks/cloud-native-security-cookbook.json","sha256":"fb86caa8416f482be6bee0216885121949aad20451f86f1cf6dd299f8795405e"}],"frozen_payload_inventory_sha256":"043391c135ba5d82c690992e81afee0fe908af1aa4b915609c263bc95cf643bc","original_acquired_at":{"reason":"not found","value":null},"original_asset":{"reason":"not found","value":null},"page_mapping":{"reason":"not found","value":null},"parent_count":256,"publication_date":{"reason":"not found","value":null},"reasons":{"dates":"No verified publication, revision or original acquisition date was found.","edition":"No verified edition-to-frozen-payload binding was found.","original_asset":"Requested main Library contains no book assets. Normalized files are separate observed witnesses.","page_mapping":"No verified physical page or EPUB-resource offset mapping exists for this frozen generation."},"revision_date":{"reason":"not found","value":null},"schema_version":"mind/frozen-source-manifest@1","source_id":"book:cloud-native-security-cookbook","source_key":"cloud-native-security-cookbook"}
