{"authority":"Frozen Mac Qdrant payload, including drifted/missing-source text; current source files are locator witnesses only.","child_count":1145,"collection":"developer_knowledge_v10","edition":{"reason":"not found","value":null},"files":[{"backend":"main-checkout","bytes":1055202,"path":"data/markdown/testing-javascript-applications.md","sha256":"cfa5d2d9ed1a3adbd047c6249c70902ad11bd6cadbd5d812d99e73877ed5e1f4"},{"backend":"main-checkout","bytes":3164058,"path":"data/chunks/testing-javascript-applications.json","sha256":"5659296af3450602b968f2b14c6b823499da76ff64ef4b394b4085d6085af4b9"}],"frozen_payload_inventory_sha256":"b54fc729adafaa557be89bdfc92f20331444a1d96245496abff28715c05282e9","original_acquired_at":{"reason":"not found","value":null},"original_asset":{"reason":"not found","value":null},"page_mapping":{"reason":"not found","value":null},"parent_count":249,"publication_date":{"reason":"not found","value":null},"reasons":{"dates":"No verified publication, revision or original acquisition date was found.","edition":"No verified edition-to-frozen-payload binding was found.","original_asset":"Requested main Library contains no book assets. Normalized files are separate observed witnesses.","page_mapping":"No verified physical page or EPUB-resource offset mapping exists for this frozen generation."},"revision_date":{"reason":"not found","value":null},"schema_version":"mind/frozen-source-manifest@1","source_id":"book:testing-javascript-applications","source_key":"testing-javascript-applications"}
