{"authority":"Frozen Mac Qdrant payload, including drifted/missing-source text; current source files are locator witnesses only.","child_count":976,"collection":"developer_knowledge_v10","edition":{"reason":"not found","value":null},"files":[{"backend":"main-checkout","bytes":898515,"path":"data/markdown/financial-ai-in-practice.md","sha256":"63e1e5ada70a7ac5d3509b8092874f9da8d0000c1eabcd2083410f2a28851e28"},{"backend":"main-checkout","bytes":2786495,"path":"data/chunks/financial-ai-in-practice.json","sha256":"837ff85d4a44fb9e45842898ff4c544253d2d61f215f185859d2b51eff8e233b"}],"frozen_payload_inventory_sha256":"59427e9176a818898e365eadead8cd3666dee4609bff9090840dc388b4ccdb90","original_acquired_at":{"reason":"not found","value":null},"original_asset":{"reason":"not found","value":null},"page_mapping":{"reason":"not found","value":null},"parent_count":239,"publication_date":{"reason":"not found","value":null},"reasons":{"dates":"No verified publication, revision or original acquisition date was found.","edition":"No verified edition-to-frozen-payload binding was found.","original_asset":"Requested main Library contains no book assets. Normalized files are separate observed witnesses.","page_mapping":"No verified physical page or EPUB-resource offset mapping exists for this frozen generation."},"revision_date":{"reason":"not found","value":null},"schema_version":"mind/frozen-source-manifest@1","source_id":"book:financial-ai-in-practice","source_key":"financial-ai-in-practice"}
