{"authority":"Frozen Mac Qdrant payload, including drifted/missing-source text; current source files are locator witnesses only.","child_count":112,"collection":"developer_knowledge_v10","edition":{"reason":"not found","value":null},"files":[{"backend":"main-checkout","bytes":89753,"path":"data/markdown/head-first-statistics-analysis.md","sha256":"072f581e3460095b613578ccedddad7f68aca1ba9b22c11ed64608f05229c0be"},{"backend":"main-checkout","bytes":282332,"path":"data/chunks/head-first-statistics-analysis.json","sha256":"55b62247613b078600ff6c337edd669c9a0ab1aecffc9c064333b945bff4fb08"}],"frozen_payload_inventory_sha256":"7d05b4a9c7b7bf416b08be3a48679781de598085551646e329e85b028cffa5b3","original_acquired_at":{"reason":"not found","value":null},"original_asset":{"reason":"not found","value":null},"page_mapping":{"reason":"not found","value":null},"parent_count":94,"publication_date":{"reason":"not found","value":null},"reasons":{"dates":"No verified publication, revision or original acquisition date was found.","edition":"No verified edition-to-frozen-payload binding was found.","original_asset":"Requested main Library contains no book assets. Normalized files are separate observed witnesses.","page_mapping":"No verified physical page or EPUB-resource offset mapping exists for this frozen generation."},"revision_date":{"reason":"not found","value":null},"schema_version":"mind/frozen-source-manifest@1","source_id":"book:head-first-statistics-analysis","source_key":"head-first-statistics-analysis"}
