{"authority":"Frozen Mac Qdrant payload, including drifted/missing-source text; current source files are locator witnesses only.","child_count":897,"collection":"developer_knowledge_v10","edition":{"reason":"not found","value":null},"files":[{"backend":"main-checkout","bytes":848085,"path":"data/markdown/how-to-read-a-paper.md","sha256":"acd15cd9fd06232cae554a390585b26d01c1a28352d4787c1412badd42d74734"},{"backend":"main-checkout","bytes":2639628,"path":"data/chunks/how-to-read-a-paper.json","sha256":"4324d416b277bc6f7688ef5b649cf1f1c482a58ad35319ae51fe0c09474320f1"}],"frozen_payload_inventory_sha256":"48b8fa54feb702fd102de0c9fde92ac45dc49cc612b530c4d9ac5e16ae02e366","original_acquired_at":{"reason":"not found","value":null},"original_asset":{"reason":"not found","value":null},"page_mapping":{"reason":"not found","value":null},"parent_count":226,"publication_date":{"reason":"not found","value":null},"reasons":{"dates":"No verified publication, revision or original acquisition date was found.","edition":"No verified edition-to-frozen-payload binding was found.","original_asset":"Requested main Library contains no book assets. Normalized files are separate observed witnesses.","page_mapping":"No verified physical page or EPUB-resource offset mapping exists for this frozen generation."},"revision_date":{"reason":"not found","value":null},"schema_version":"mind/frozen-source-manifest@1","source_id":"book:how-to-read-a-paper","source_key":"how-to-read-a-paper"}
