{"authority":"Frozen Mac Qdrant payload, including drifted/missing-source text; current source files are locator witnesses only.","child_count":537,"collection":"developer_knowledge_v10","edition":{"reason":"not found","value":null},"files":[{"backend":"main-checkout","bytes":515521,"path":"data/markdown/fundamentals-microsoft-fabric.md","sha256":"d7b2d85878909ee1efe495b25aa1ec9059472f61e4ba3105c930abf0b075ea97"},{"backend":"main-checkout","bytes":1520233,"path":"data/chunks/fundamentals-microsoft-fabric.json","sha256":"6c41c7074a8e78853a993de41e676101dcff1a7c20f488220a05874015a51609"}],"frozen_payload_inventory_sha256":"5118739a5f227e885d6e23defaa53f66eda42b915a909e8ae995767244343de8","original_acquired_at":{"reason":"not found","value":null},"original_asset":{"reason":"not found","value":null},"page_mapping":{"reason":"not found","value":null},"parent_count":173,"publication_date":{"reason":"not found","value":null},"reasons":{"dates":"No verified publication, revision or original acquisition date was found.","edition":"No verified edition-to-frozen-payload binding was found.","original_asset":"Requested main Library contains no book assets. Normalized files are separate observed witnesses.","page_mapping":"No verified physical page or EPUB-resource offset mapping exists for this frozen generation."},"revision_date":{"reason":"not found","value":null},"schema_version":"mind/frozen-source-manifest@1","source_id":"book:fundamentals-microsoft-fabric","source_key":"fundamentals-microsoft-fabric"}
