{"authority":"Frozen Mac Qdrant payload, including drifted/missing-source text; current source files are locator witnesses only.","child_count":1104,"collection":"developer_knowledge_v10","edition":{"reason":"not found","value":null},"files":[{"backend":"main-checkout","bytes":1177685,"path":"data/markdown/building-secure-reliable-systems.md","sha256":"6cdc5d2fa004f634b82b867c90267dcc43ff65d572aa073be2010d5a056036dc"},{"backend":"main-checkout","bytes":3469692,"path":"data/chunks/building-secure-reliable-systems.json","sha256":"2d7f18a61d5d9b558763ea52cf3b92dbae8693497627c9d2db6db1d5d8f9b8e9"}],"frozen_payload_inventory_sha256":"c7371e0cc37fc737566e7e926aecc5ee88fb7a378bc7c41bc30e31af78be9736","original_acquired_at":{"reason":"not found","value":null},"original_asset":{"reason":"not found","value":null},"page_mapping":{"reason":"not found","value":null},"parent_count":411,"publication_date":{"reason":"not found","value":null},"reasons":{"dates":"No verified publication, revision or original acquisition date was found.","edition":"No verified edition-to-frozen-payload binding was found.","original_asset":"Requested main Library contains no book assets. Normalized files are separate observed witnesses.","page_mapping":"No verified physical page or EPUB-resource offset mapping exists for this frozen generation."},"revision_date":{"reason":"not found","value":null},"schema_version":"mind/frozen-source-manifest@1","source_id":"book:building-secure-reliable-systems","source_key":"building-secure-reliable-systems"}
