{"authority":"Frozen Mac Qdrant payload, including drifted/missing-source text; current source files are locator witnesses only.","child_count":522,"collection":"developer_knowledge_v10","edition":{"reason":"not found","value":null},"files":[{"backend":"main-checkout","bytes":504284,"path":"data/markdown/web-performance-engineering.md","sha256":"ab6592f35c8bc3bdcdf241fddfbeee703f0997b63d82f748f6bcf786ced4c37c"},{"backend":"main-checkout","bytes":1632289,"path":"data/chunks/web-performance-engineering.json","sha256":"f8bb1b781932480042a578572f9a375170f3f89b7462b8218567663347214f44"}],"frozen_payload_inventory_sha256":"d12423d7d40b0058505a9de35d0e906b3d7ecf787a3e38c2b79b15413162901a","original_acquired_at":{"reason":"not found","value":null},"original_asset":{"reason":"not found","value":null},"page_mapping":{"reason":"not found","value":null},"parent_count":219,"publication_date":{"reason":"not found","value":null},"reasons":{"dates":"No verified publication, revision or original acquisition date was found.","edition":"No verified edition-to-frozen-payload binding was found.","original_asset":"Requested main Library contains no book assets. Normalized files are separate observed witnesses.","page_mapping":"No verified physical page or EPUB-resource offset mapping exists for this frozen generation."},"revision_date":{"reason":"not found","value":null},"schema_version":"mind/frozen-source-manifest@1","source_id":"book:web-performance-engineering","source_key":"web-performance-engineering"}
