{"authority":"Frozen Mac Qdrant payload, including drifted/missing-source text; current source files are locator witnesses only.","child_count":878,"collection":"developer_knowledge_v10","edition":{"reason":"not found","value":null},"files":[{"backend":"main-checkout","bytes":886008,"path":"data/markdown/domain-driven-design-evans.md","sha256":"8123c15c7619f63ec944f82f56839573b54335742b02a1001fb072a128d9748d"},{"backend":"main-checkout","bytes":2453894,"path":"data/chunks/domain-driven-design-evans.json","sha256":"9ba5106352448fc1a561367a50b5092197415d71f21df3f62062265f6a5b6cd0"}],"frozen_payload_inventory_sha256":"bca3e231b0aa4fa073723dc1e0d1a96c69e9ff4dd3ad0ab65b45724e7531d77f","original_acquired_at":{"reason":"not found","value":null},"original_asset":{"reason":"not found","value":null},"page_mapping":{"reason":"not found","value":null},"parent_count":185,"publication_date":{"reason":"not found","value":null},"reasons":{"dates":"No verified publication, revision or original acquisition date was found.","edition":"No verified edition-to-frozen-payload binding was found.","original_asset":"Requested main Library contains no book assets. Normalized files are separate observed witnesses.","page_mapping":"No verified physical page or EPUB-resource offset mapping exists for this frozen generation."},"revision_date":{"reason":"not found","value":null},"schema_version":"mind/frozen-source-manifest@1","source_id":"book:domain-driven-design-evans","source_key":"domain-driven-design-evans"}
