{"authority":"Frozen Mac Qdrant payload, including drifted/missing-source text; current source files are locator witnesses only.","child_count":326,"collection":"developer_knowledge_v10","edition":{"reason":"not found","value":null},"files":[{"backend":"main-checkout","bytes":372948,"path":"data/markdown/ux-for-lean-startups.md","sha256":"535bbaf83496e2348e05ad75d7c1c210be6c76185b9639442ee23a0199dc63c8"},{"backend":"main-checkout","bytes":972858,"path":"data/chunks/ux-for-lean-startups.json","sha256":"b93d7ea27cbe8091cc3aa54bdae6a06044e32f7b8662cd146521d906a249905e"}],"frozen_payload_inventory_sha256":"a6d2d8f375addb7a54704524098edae77e30959ba7cd7db1078c1d8418cd20af","original_acquired_at":{"reason":"not found","value":null},"original_asset":{"reason":"not found","value":null},"page_mapping":{"reason":"not found","value":null},"parent_count":64,"publication_date":{"reason":"not found","value":null},"reasons":{"dates":"No verified publication, revision or original acquisition date was found.","edition":"No verified edition-to-frozen-payload binding was found.","original_asset":"Requested main Library contains no book assets. Normalized files are separate observed witnesses.","page_mapping":"No verified physical page or EPUB-resource offset mapping exists for this frozen generation."},"revision_date":{"reason":"not found","value":null},"schema_version":"mind/frozen-source-manifest@1","source_id":"book:ux-for-lean-startups","source_key":"ux-for-lean-startups"}
