{"authority":"Frozen Mac Qdrant payload, including drifted/missing-source text; current source files are locator witnesses only.","child_count":290,"collection":"developer_knowledge_v10","edition":{"reason":"not found","value":null},"files":[{"backend":"main-checkout","bytes":226957,"path":"data/markdown/creating-web-animations.md","sha256":"135968d18a6bf4dafd796a7353d1dca7ab4b9cdcf1be35fe19600f4942d13b3e"},{"backend":"main-checkout","bytes":754885,"path":"data/chunks/creating-web-animations.json","sha256":"883ccbd70b562b080c87a54ce49d5f628311e04a4c1566015dadc4c3abda037f"}],"frozen_payload_inventory_sha256":"bd5eed62a9c3532bf074ae68492ce0bfadabc41c44ae578e2ebb6e41cc341955","original_acquired_at":{"reason":"not found","value":null},"original_asset":{"reason":"not found","value":null},"page_mapping":{"reason":"not found","value":null},"parent_count":114,"publication_date":{"reason":"not found","value":null},"reasons":{"dates":"No verified publication, revision or original acquisition date was found.","edition":"No verified edition-to-frozen-payload binding was found.","original_asset":"Requested main Library contains no book assets. Normalized files are separate observed witnesses.","page_mapping":"No verified physical page or EPUB-resource offset mapping exists for this frozen generation."},"revision_date":{"reason":"not found","value":null},"schema_version":"mind/frozen-source-manifest@1","source_id":"book:creating-web-animations","source_key":"creating-web-animations"}
