{"authority":"Frozen Mac Qdrant payload, including drifted/missing-source text; current source files are locator witnesses only.","child_count":2008,"collection":"philosophy","edition":{"reason":"not found","value":null},"files":[{"backend":"main-checkout","bytes":1028162,"path":"data/markdown/philosophy/zhuan-falun.zh-Hans.md","sha256":"fd77179474938bc0ef30905d3af9b4dcda2d881e41aeb614fd9af51eeec0a3fb"},{"backend":"main-checkout","bytes":3567246,"path":"data/chunks/philosophy/zhuan-falun.zh-Hans.json","sha256":"de697300d7379d2d957ab3a304cc0ec01ab4523d7155a61bae4fc8d3118a9556"}],"frozen_payload_inventory_sha256":"a4c80484b95269ca8a1efc12f8012fcbee31243aad2f284ce22b7605c669c288","original_acquired_at":{"reason":"not found","value":null},"original_asset":{"reason":"not found","value":null},"page_mapping":{"reason":"not found","value":null},"parent_count":243,"publication_date":{"reason":"not found","value":null},"reasons":{"dates":"No verified publication, revision or original acquisition date was found.","edition":"No verified edition-to-frozen-payload binding was found.","original_asset":"Requested main Library contains no book assets. Normalized files are separate observed witnesses.","page_mapping":"No verified physical page or EPUB-resource offset mapping exists for this frozen generation."},"revision_date":{"reason":"not found","value":null},"schema_version":"mind/frozen-source-manifest@1","source_id":"philosophy:zhuan-falun.zh-Hans","source_key":"zhuan-falun.zh-Hans"}
