{"authority":"Frozen Mac Qdrant payload, including drifted/missing-source text; current source files are locator witnesses only.","child_count":512,"collection":"developer_knowledge_v10","edition":{"reason":"not found","value":null},"files":[{"backend":"main-checkout","bytes":462582,"path":"data/markdown/real-world-svelte.md","sha256":"43a61338d7bd202619698f1178cf81a459dc89f89dee439a0f2cdb92ff236396"},{"backend":"main-checkout","bytes":1378725,"path":"data/chunks/real-world-svelte.json","sha256":"c49a9b100724bd71820b2c8335b15f80810f7ea40543f7e40160e92e4fe71dc9"}],"frozen_payload_inventory_sha256":"f272e8bd69f0d0473a4c104dc3318d3153d63c1039f0a9f88ad7a3a03c4680b4","original_acquired_at":{"reason":"not found","value":null},"original_asset":{"reason":"not found","value":null},"page_mapping":{"reason":"not found","value":null},"parent_count":142,"publication_date":{"reason":"not found","value":null},"reasons":{"dates":"No verified publication, revision or original acquisition date was found.","edition":"No verified edition-to-frozen-payload binding was found.","original_asset":"Requested main Library contains no book assets. Normalized files are separate observed witnesses.","page_mapping":"No verified physical page or EPUB-resource offset mapping exists for this frozen generation."},"revision_date":{"reason":"not found","value":null},"schema_version":"mind/frozen-source-manifest@1","source_id":"book:real-world-svelte","source_key":"real-world-svelte"}
